Year,Month,#,CODE,Authors,Conference,Location,Invited,Organization,Pages,Title,Volume,Eval
2008,6,A,C08A,"Caylor, Kelly K and Scanlon, Todd M and Rodriguez-Iturbe, Ignacio",Water and the Environment: Proceedings of the Workshop in the Vatican Academy of Sciences,,,,,Ecohydrological optimization of pattern and processes in water-limited ecosystems,,0
2008,12,B,C08B,"Vinukollu, RK and Caylor, K and Wood, EF",American Geophysical Union Fall Meeting,,,,,Evaluation of a global evapotranspiration product using FLUXNET data,,0
2008,8,C,C08C,"Caylor, Kelly K and Scanlon, Todd",The 93rd Ecological Society of America Annual Meeting,,,,,OOS 13-6: Transitions between facilitative/competitive effects of tree canopies on herbaceous productivity via impacts on energy/water balance,,0
2008,5,D,C08D,"Caylor, Kelly K and Franz, Trenton",The 2008 Joint Annual Meeting,,,,,Using Geophysical Measurements to Infer Subsurface Vegetation Patterns and Processes.,,0
2008,7,E,C08E,"Dragoni, D and Caylor, K.K.",VII International Workshop on Sap Flow 846,,,,69--76,Decoupling Structural and Environmental Determinants of Sap Velocity Using Heat Pulse Methods,,0
2008,12,F,C08F,"Franz, TE and King, EG and Lester, A and Caylor, K.K. and Nordbotten, J and Celia, MA and Rodriguez-Iturbe, I",American Geophysical Union Fall Meeting,,,,,Ecohydrologic Modeling of Hillslope Scale Processes in Dryland Ecosystems,,0
2008,12,G,C08G,"Caylor, K.K. and Franz, T",American Geophysical Union Fall Meeting,,,,,Impacts of climate variability on functional diversity and species distribution in dryland ecosystems,,0
2008,8,H,C08H,"Franz, Trenton and King, Elizabeth and Lester, Alex and Caylor, Kelly K and Celia, Michael and Rodriguez-Iturbe, Ignacio and Rubenstein, Daniel I",The 93rd Ecological Society of American Annual Meeting,,,,,OOS 2-1: Differences in small-scale water balance by representative hydrologic units of central Kenya,,0
2008,12,I,C08I,"Wang, L and Caylor, K and Dragoni, D",American Geophysical Union Fall Meeting,,,,,Measuring hourly 18O and 2H fluxes in a mixed hardwood forest using an integrated cavity output spectrometer,,0
2007,12,A,C07A,"Lindner, GA and Caylor, K.K.",American Geophysical Union Fall Meeting,,,,,Assessing the Impact of Spatial Scaling on Empirical Runoff Ratio Models within a Heterogeneous Suburbanizing Watershed in Central Indiana,,0
2007,12,B,C07B,"Caylor, K.K. and Dragoni, D",American Geophysical Union Fall Meeting,,,,,Decoupling structural and environmental determinants of sap velocity,,0
2007,5,C,C07C,"Caylor, K.K. and D'Odorico, P and Okin, GS",American Geophysical Union Fall Meeting,,,,,Evidence and implications of soil moisture-vegetation feedbacks in semiarid savannas,,0
2006,12,A,C06A,"Scanlon, TM and D'Odorico, P and Okin, GS and Caylor, K.K.",American Geophysical Union Fall Meeting,,,,,Effects of mean annual rainfall on landscape-level distributions of soil moisture and soil development in a semi-arid ecosystem,,0
2006,12,B,C06B,"Dragoni, D and Caylor, K.K. and Schmid, H",American Geophysical Union Fall Meeting,,,,,Characterization of transpiration in a deciduous forest of the US Midwest,,0
2006,12,C,C06C,"Ries, LP and Shugart, HH and Caylor, K.K. and Okin, GS and Kgope, B",American Geophysical Union Fall Meeting,,,,,Nutrient and light limitations on grass productivity in a southern African savanna,,0
2005,5,A,C05A,"Caylor, K.K. and Rodriguez-Iturbe, I",American Geophysical Union Spring Meeting,,,,,Spatial variation of surface hydrological dynamics in semi-arid landscapes,,0
2004,6,A,C04A,"Caylor, Kelly K and Rodriguez-Iturbe, Ignacio",Proceedings of the British Hydrological Society’s International Conference on Hydrology: Science and Practice for the 21st century,,,,39--47,Coupling ecohydrological patterns and processes in semi-arid landscapes,2,0
2004,5,B,C04B,"Scanlon, TM and Caylor, K.K. and Rodriguez-Iturbe, I",American Geophysical Union Fall Meeting,,,,,Ecohydrological significance of observed power-law distributions of tree canopy cluster sizes for savanna vegetation,,0
2004,12,C,C04C,"Caylor, K and D'Odorico, P and Rodriguez-Iturbe, I",American Geophysical Union Fall Meeting,,,,,Horizontal and vertical variability of soil moisture in savanna ecosystems,,0
2003,12,A,C03A,"Manfreda, S and Caylor, K and Rodriguez-Iturbe, I",American Geophysical Union Fall Meeting,,,,,On The Soil Moisture Dynamics: Does Simplification Alter Soil Moisture Prediction?,,0
2003,4,B,C03B,"Hély, C and Caylor, K.K. and Alleaume, S and Swap, RJ and Shugart, HH",EGS-AGU-EGU Joint Assembly,,,,,Estimating emissions of carbonaceous compounds from southern african fires: a re-analysis of modeling techniques,,0
2003,12,C,C03C,"Shugart, HH and Caylor, K.K. and Scanlon, TM and Rodriguez-Iturbe, I",American Geophysical Union Fall Meeting,,,,,Assessing the role of spatial pattern in governing ecohydrological interactions and vegetation dynamics in semi-arid savannas.,,0
2002,5,A,C02A,"Caylor, K.K. and Shugart, HH",American Geophysical Union Fall Meeting,,,,,Simulated water-use of heterogeneous vegetation patches along the Kalahari transect,,0
2001,12,A,C01A,"Shugart, HH and Caylor, K.K. and Dowty, PR",American Geophysical Union Fall Meeting,,,,,Ecological Scale Issues in Land/Atmosphere Coupling-Examples from SAFARI 2000,,0
2001,12,B,C01B,"Scanlon, TM and Albertson, JD and Caylor, K.K. and Williams, CA",American Geophysical Union Fall Meeting,,,,,"Assessing Fractional Tree, Grass, and Bare Soil Cover from NDVI and Rainfall Time Series along the Kalahari Transect, Africa",,0
2001,5,C,C01C,"Caylor, K.K. and Shugart, HH",American Geophysical Union Fall Meeting,,,,,Variation in vegetation structure along a large moisture gradient: The role of rainfall variability in maintaining spatial heterogeneity,,0
2001,12,D,C01D,"Caylor, K.K. and Dowty, PR and Shugart, HH",American Geophysical Union Fall Meeting,,,,,Relationship between small-scale structural heterogeneity and simulated vegetation productivity across a regional moisture gradient,,0